Body Part,Organ,Incidental_Finding,ICD-10 Code,ICD-10 Code Description
Abdomen,Adrenal Glands,Adrenal Gland Tumor,D44.7,"Neoplasm of uncertain behavior of endocrine glands, other specified endocrine glands."
Abdomen,Bladder,Bladder Cancer,C67.9,"Malignant neoplasm of bladder, unspecified"
Abdomen,Bladder,Bladder Diverticula,N32.3,Diverticulum of bladder
Abdomen,Bladder,Bladder Calculus,N21.0,Calculus in bladder
Abdomen,Bladder,Bladder Diverticulum,N32.3,Diverticulum of bladder
Abdomen,Bladder,Bladder Mass,R93.4,Abnormal findings on diagnostic imaging of urinary organs
Abdomen,Bladder,Bladder Wall Thickening,R93.4,Abnormal findings on diagnostic imaging of urinary organs
Abdomen,Gallbladder,Gallbladder Wall Thickening,K81.9,"Cholecystitis, unspecified"
Abdomen,Gallbladder,Gallbladder Tumor,D37.6,Neoplasm of uncertain behavior of other and unspecified digestive organs
Abdomen,Gallbladder,Gallbladder Agenesis,Q44.0,Congenital absence of gallbladder
Abdomen,Gallbladder,Cholelithiasis,K80.20,"Calculus of gallbladder without cholecystitis, without obstruction"
Abdomen,Gallbladder,Gallstones ,K80.20,"Calculus of gallbladder without cholecystitis, without obstruction"
Abdomen,Intestines,Appendicitis,K35.80,Unspecified acute appendicitis
Abdomen,Intestines,Bowel Wall Thickening,R93.3,Abnormal findings on diagnostic imaging of other parts of digestive tract
Abdomen,Kidneys,Angiomyolipoma,D30.0,Benign neoplasm of kidney
Abdomen,Gallbladder,Adenomyomatosis,K82.8,Other specified diseases of gallbladder
Abdomen,Liver,Liver Steatosis,K76.0,"Fatty (change of) liver, not elsewhere classified"
Abdomen,Liver,Liver Cirrhosis,K74.60,Unspecified cirrhosis of liver
Abdomen,Intestines,Crohn's Disease,K50.90,"Crohn's disease, unspecified, without complications"
Abdomen,Liver,Hepatic Hemangioma,D18.09,Hemangioma of other sites
Abdomen,Liver,Hepatomegaly,R16.0,"Hepatomegaly, not elsewhere classified"
Abdomen,Kidneys,Medullary Sponge Kidney,Q61.5,Medullary cystic kidney
Abdomen,Kidneys,Polycystic Kidney Disease,Q61.3,"Polycystic kidney, unspecified"
Abdomen,Kidneys,Renal Cortical Thinning,N26.1,Atrophy of kidney
Abdomen,Retroperitoneum,Retroperitoneal Fibromatosis,M72.9,"Fibromatosis, unspecified"
Abdomen,Retroperitoneum,Retroperitoneal Lymphadenopathy,R59.0,Localized enlarged lymph nodes
Abdomen,Kidneys,Renal Cyst with Septations,N28.1,"Cyst of kidney, acquired"
Abdomen,Intestines,Mesenteric Cyst,R93.3,Abnormal findings on diagnostic imaging of other abdominal regions
Abdomen,Intestines,Intestinal Stricture,K56.60,Unspecified intestinal obstruction
Abdomen,Kidneys,Simple Renal Cyst,N28.1,"Cyst of kidney, acquired"
Abdomen,Liver,Hepatic Adenoma,D13.4,Benign neoplasm of liver
Abdomen,Spleen,Splenic Cyst,D73.4,Cyst of spleen
Abdomen,Spleen,Splenomegaly,R16.1,"Splenomegaly, not elsewhere classified"
Abdomen,Spleen,Splenic Calcification,D73.5,Infarction of spleen
Abdomen,Stomach,Gastric Ulcer,K25.9,"Gastric ulcer, unspecified as acute or chronic, without hemorrhage or perforation"
Abdomen,Stomach,Gastric Wall Thickening,R93.3,Abnormal findings on diagnostic imaging of other abdominal regions
Abdomen,Intestines,Intussusception,K56.1,Intussusception
Chest,Mediastinum,Thymoma,C37,Malignant neoplasm of thymus
Chest,Lung,Lymphangioleiomyomatosis,J84.81,Lymphangioleiomyomatosis
Chest,Lung,Hypersensitivity Pneumonitis,J67.9,Hypersensitivity pneumonitis due to unspecified organic dust
Chest,Trachea,Tracheal Wall Thickening,J39.8,Other specified diseases of upper respiratory tract
Chest,Vessels,Thoracic Aortic Aneurysm,I71.2,Thoracic aortic aneurysm without rupture
Chest,Vessels,Superior Vena Cava Syndrome,I87.8,Other specified disorders of veins
Chest,Vessels,Thoracic Aortic Dissection,I71.00,"Dissection of aorta, unspecified site"
Head,Brain,Porencephalic Cyst,Q04.6,Congenital porencephaly
Head,Brain,Perivascular Spaces Dilatation,G93.9,"Disorder of brain, unspecified"
Head,Brain,White Matter Hyperintensity,R90.89,Other abnormal findings on diagnostic imaging of central nervous system
Head,Brain,Colloid Cyst,G93.0,Cebebral cysts
Head,Brain,Cystic Lesion of Choroid Plexus,Q04.8,Other specified congenital malformations of brain
Head,Brain,Periventricular Leukomalacia,P91.2,Cystic periventricular leukomalacia
Head,Brain,Normal Pressure Hydrocephalus,G91.2,Normal pressure hydrocephalus
Head,Brain,Spinal Canal Stenosis,M48.0,"Spinal stenosis, site unspecified"
Head,Brain,Trigeminal Neuralgia,G50.0,Trigeminal neuralgia
Head,Brain,Ischemic White Matter Disease,R90.82 ,"White matter disease, unpsecified "
Head,Brain,Juvenile Pilocytic Astrocytoma,D33.1,"Benign neoplasm of brain, infratentorial"
Head,Brain,Spongiform Changes in Brain,A81.9,"Prion disease, unspecified"
Head,Ears,Otitis Media,H66.90,"Otitis media, unspecified, unspecified ear"
Head,Jaw,TMJ Disorder,M26.62,Arthralgia of temporomandibular joint
Head,Jaw,Odontogenic Cyst,K09.0,Developmental (nonodontogenic) cysts of oral region
Head,Nasal Cavity,Deviated Nasal Septum,J34.2,Deviated nasal septum
Head,Nasal Cavity,Turbinate Hypertrophy,J34.3,Hypertrophy of nasal turbinates
Head,Soft Tissue,Hemangioma of Head,D18.01,Hemangioma of skin and subcutaneous tissue
Head,Soft Tissue,Lipoma of Face,D17.0,"Benign lipomatous neoplasm of skin and subcutaneous tissue of head, face and neck"
Head,Soft Tissue,Cutaneous Abscess of Scalp,L02.81,"Cutaneous abscess of head [any part], except face"
Head,Soft Tissue,Scalp Lipoma,D17.0,"Benign lipomatous neoplasm of skin and subcutaneous tissue of head, face and neck"
Neck,Esophagus,Zenker's Diverticulum,K22.5,"Diverticulum of esophagus, acquired"
Neck,Esophagus,Cervical Esophageal Ulcer,K22.1,Esophageal ulcer
Neck,Lymph Nodes,Enlarged Cervical Lymph Nodes,R59.0,Localized enlarged lymph nodes
Neck,Lymph Nodes,Calcified Lymph Node,R93.0,Abnormal findings on diagnostic imaging of skull and head region
Neck,Lymph Nodes,Metastatic Lymphadenopathy,C77.0,"Secondary and unspecified malignant neoplasm of lymph nodes of head, face, and neck"
Neck,Lymph Nodes,Lymph Node Calcification,R22.1,"Localized swelling, mass, and lump, neck"
Neck,Lymph Nodes,Granulomatous Lymphadenitis,I88.1,Chronic nonspecific lymphadenitis
Neck,Muscles,Cervical Muscle Spasm,M62.838,Other muscle spasm
Neck,Nerves,Cervical Nerve Root Compression,M54.12,"Radiculopathy, cervical region"
Neck,Nerves,Brachial Plexus Lesion,G54.0,Brachial plexus disorders
Neck,Parathyroid,Parathyroid Carcinoma,C75.0,Malignant neoplasm of parathyroid gland
Neck,Parathyroid,Parathyroid Cyst,E21.5,"Disorder of parathyroid gland, unspecified"
Neck,Pharynx,Hypertrophy of Pharyngeal Tonsils,J35.2,Hypertrophy of adenoids
Neck,Vessels,Arteriovenous Malformation,Q28.2,Arteriovenous malformation of vessel of brain
Neck,Vessels,Vertebral Artery Stenosis,I65.8,Occlusion and stenosis of other precerebral arteries
Neck,Vessels,Carotid Artery Dissection,I77.71,Dissection of carotid artery